publicacao;cidade;UF;data;texto_contrato
Edição Nº 161 de 24/08/2022 - Pág. 321;PREFEITURA MUNICIPAL DE ITAMBÉ;Estado de Pernambuco;24/08/2022;"Processo Administrativo n° 021/2022 - Inexigibilidade de Licitação nº 002/2022. Objeto: Contratação de empresa para intermediar a apresentação de Show Musical, dentro da programação do evento ""Festival Canavial do Município de Itambé-PE"", de acordo com o convênio nº 928182/2022, firmado com o Ministério do Turismo. Partes: Município de Itambé-PE (CNPJ nº 10.150.050/0001-09) e Cactus Promoções e Produções - Eireli (CNPJ nº 17.164.219/0001-29) - Contrato nº 043/2022 - Valor R$ 10.000,00. Fundamentação Legal: art. 25, III, da Lei nº 8.666/93, e alterações posteriores. Data 11/08/2022.Processo Administrativo n° 022/2022 - Inexigibilidade de Licitação nº 003/2022. Objeto: Contratação de empresa para intermediar a apresentação de Show Musical, dentro da programação do evento ""Festival Canavial do Município de Itambé-PE"", de acordo com o convênio nº 928182/2022, firmado com o Ministério do Turismo. Partes: Município de Itambé-PE (CNPJ nº 10.150.050/0001-09) e Cactus Promoções e Produções - Eireli (CNPJ nº 17.164.219/0001-29) - Contrato nº 044/2022 - Valor R$ 36.000,00. Fundamentação Legal: art. 25, III, da Lei nº 8.666/93, e alterações posteriores. Data 11/08/2022.Processo Administrativo n° 023/2022 - Inexigibilidade de Licitação nº 004/2022. Objeto: Contratação de empresa para intermediar a apresentação de Show Musical, dentro da programação do evento ""Festival Canavial do Município de Itambé-PE"", de acordo com o convênio nº 928182/2022, firmado com o Ministério do Turismo. Partes: Município de Itambé-PE (CNPJ nº 10.150.050/0001-09) e AC Prime Produções e Eventos - Eireli (CNPJ nº 22.276.054/0001-17) - Contrato nº 045/2022 - Valor R$ 25.000,00. Fundamentação Legal: art. 25, III, da Lei nº 8.666/93, e alterações posteriores. Data 11/08/2022.Processo Administrativo n° 024/2022 - Inexigibilidade de Licitação nº 005/2022. Objeto: Contratação de empresa para intermediar a apresentação de Show Musical, dentro da programação do evento ""Festival Canavial do Município de Itambé-PE"", de acordo com o convênio nº 928182/2022, firmado com o Ministério do Turismo. Partes: Município de Itambé-PE (CNPJ nº 10.150.050/0001-09) e Assossiação Maracatu Estrela de Ouro de Aliança (CNPJ nº 12.813.069/0001-13) - Contrato nº 046/2022 - Valor R$ 10.000,00. Fundamentação Legal: art. 25, III, da Lei nº 8.666/93, e alterações posteriores. Data 11/08/2022.Processo Administrativo n° 025/2022 - Inexigibilidade de Licitação nº 006/2022. Objeto: Contratação de empresa para intermediar a apresentação de Show Musical, dentro da programação do evento ""Festival Canavial do Município de Itambé-PE"", de acordo com o convênio nº 928182/2022, firmado com o Ministério do Turismo. Partes: Município de Itambé-PE (CNPJ nº 10.150.050/0001-09) e Assossiação Pro-Cidadania (CNPJ nº 69.930.345/0001-40) - Contrato nº 047/2022 - Valor R$ 20.000,00. Fundamentação Legal: art. 25, III, da Lei nº 8.666/93, e alterações posteriores. Data 11/08/2022."
Edição Nº 160 de 23/08/2022 - Pág. 267;PREFEITURA MUNICIPAL DE CANAÃ DOS CARAJÁS;Estado do Pará;23/08/2022;CONTRATO Nº: 20221420ORIGEM: INEXIGIBILIDADE Nº 190/2022/PMCCCONTRATANTE: PREFEITURA MUNICIPAL DE CANAÃ DOS CARAJÁS,CONTRATADA(O): AVINE VINNY PRODUÇÕES ARTISTICAS LTDA,OBJETO: Contratação de evento artístico de SHOW da Banda AVINE VINNY, para o dia 03 de setembro de 2022 em alusão da Comemoração do 5º FESTIVAL GASTRONÔMICO em CANAÃ DOS CARAJÁS no município de Canaã dos Carajás- PA. VALOR TOTAL: R$ 130.000,00 (cento e trinta mil reais),O Contrato encontra-se disponíveis aos interessados para consulta e baixa (download www.portaldecompraspublicas.com.br/ e http://www.canaadoscarajas.pa.gov.br/editais/. VIGÊNCIA: 16 de Agosto de 2022 a 16 de Agosto de 2023,DATA DA ASSINATURA: 16 de Agosto de 2022.
Edição Nº 160 de 23/08/2022 - Pág. 226;PREFEITURA MUNICIPAL DE ITAPEBI;Estado da Bahia;23/08/2022;"Contrato FMS nº 020/2022 - Contratante: MUNICÍPIO DE ITAPEBI - CNPJ: 13.634.993/0001-03 - Contratado: ANDERSON SALES FRANCISCO - CPF: 099.552.726-19 - Objeto: Contratação de profissional prestação de serviços técnicos especializados de assessoria e consultoria jurídica nos procedimentos para credenciamento de profissionais das áreas de saúde e assistência social, para atender às necessidades do Fundo Municipal de Saúde e do Fundo Municipal de Assistência Social deste Município de Itapebi/BA. - Vigência: 01/07/2022 até 31/12/2022. - Valor: R$ 144.000,00 (Cento e quarenta e quatro mil reais). - Base Legal: Art. 74, III, da Lei Federal 14.133/2021 - Processo Administrativo nº. 077/2022 - Inexigibilidade de Licitação n°. 027/2022. - Signatários: pela Contratante - Juarez da Silva Oliveira; pela Contratada - Anderson Sales Francisco. - Data da Assinatura: 01/07/2022. - JUAREZ DA SILVA OLIVEIRA - Prefeito Municipal.Contrato nº 047/2022 - Contratante: MUNICÍPIO DE ITAPEBI - CNPJ: 13.634.993/0001-03 -Contratada: T N KALID PRODUÇÕES E EVENTOS EIRELI ME - CNPJ: 27.538.624/0001-13 - Objeto: Contratação de shows artísticos musicais da Banda Papazoni e Banda Kaio Oliveira, durante os festejos de ""São Cristóvão"", Padroeiro do Povoado de Ventania, com apresentação nos dias 23 e 24/07/2022, neste Município de Itapebi/BA. - Vigência: 20/07/2022 até 31/08/2022. - Valor: R$ 93.000,00 (Noventa e três mil reais). - Base Legal: Art. 74, II, da Lei Federal 14.133/2021 - Processo Administrativo nº. 084/2022 - Inexigibilidade de Licitação n°. 029/2022. - Signatários: pela Contratante - Juarez da Silva Oliveira; pela Contratada - Tiago Neto Kalid. - Data da Assinatura: 20/07/2022. - JUAREZ DA SILVA OLIVEIRA - Prefeito Municipal.Contrato nº 049/2022 - Contratante: MUNICÍPIO DE ITAPEBI - CNPJ: 13.634.993/0001-03 -Contratada: A5 ENTRETENIMENTO PUBLICIDADE E PROPAGANDA LTDA - CNPJ: 07.229.759/0001-90 - Objeto: Contratação de show artístico musical da ""BANDA PARANGOLÉ"", durante os Festejos de Aniversário de Emancipação Política do Município de Itapebi, com apresentação no dia 12/08/2022, na sede deste Município. - Vigência: 29/07/2022 até 31/08/2022. - Valor: R$ 160.000,00 (Cento e sessenta mil reais). - Base Legal: Art. 74, II, da Lei Federal 14.133/2021 - Processo Administrativo nº. 087/2022 - Inexigibilidade de Licitação n°. 030/2022. - Signatários: pela Contratante - Juarez da Silva Oliveira; pela Contratada - Flávio Costa Maron. - Data da Assinatura: 29/07/2022. - JUAREZ DA SILVA OLIVEIRA - Prefeito Municipal."
Edição Nº 159 de 22/08/2022 - Pág. 277;PREFEITURA MUNICIPAL DE CANAÃ DOS CARAJÁS;Estado do Pará;22/08/2022;ORIGEM: INEXIGIBILIDADE Nº 190/2022/PMCCCONTRATANTE: PREFEITURA MUNICIPAL DE CANAÃ DOS CARAJÁS,CONTRATADA(O): AVINE VINNY PRODUÇÕES ARTISTICAS LTDA,OBJETO: Contratação de evento artístico de SHOW da Banda AVINE VINNY, para o dia 03 de setembro de 2022 em alusão da Comemoração do 5º FESTIVAL GASTRONÔMICO em CANAÃ DOS CARAJÁS no município de Canaã dos Carajás- PA.VALOR TOTAL: R$ 130.000,00 (cento e trinta mil reais),O Contrato encontra-se disponíveis aos interessados para consulta e baixa (download www.portaldecompraspublicas.com.br/e http://www.canaadoscarajas.pa.gov.br/editais/.VIGÊNCIA: 16 de Agosto de 2022 a 16 de Agosto de 2023,DATA DA ASSINATURA: 16 de Agosto de 2022
Edição Nº 159 de 22/08/2022 - Pág. 259;Prefeitura Municipal de Porto Alegre do Norte;Estado de Mato Grosso;22/08/2022;Espécie: Contrato Administrativo nº 43/2022. Fundamento: Processo Administrativo nº 109/2022 Dispensa de Licitação nº 33/2022. EMPRESA: NT PROMOTORA DE EVENTOS LTDA - EPP CNPJ nº 42.180.015/0001-29 Valor total R$ 12.000,00 (Doze mil reais). OBJETO: Contratação de empresa especializada para prestação de serviços de locação de GERADOR de ENERGIA 180 KVA para a realização de rodeio show no Município de Porto Alegre do Norte /MT, nos dias 24 a 27 de agosto de 2022, Termo de Convênio 1340/2022. O prazo de vigência do presente Contrato é de 180 (cento e oitenta) dias, a contar da assinatura do contrato. 19/08/2022 á 19/02/2023.Espécie: Contrato Administrativo nº 44/2022. Fundamento: Processo Administrativo nº 110/2022 Dispensa de Licitação nº 34/2022. EMPRESA: NT PROMOTORA DE EVENTOS LTDA - EPP CNPJ nº 42.180.015/0001-29 Valor total R$ 16.000,00 (Dezesseis mil reais). OBJETO: Contratação de empresa especializada para prestação de serviços de locação de 4 DIARIAS DE SOM PA24 PARA O RODEIO, para a realização de rodeio show no Município de Porto Alegre do Norte /MT, nos dias 24 a 27 de agosto de 2022, Termo de Convenio 1340/2022, para atender as necessidades da Secretaria de Educação, Cultura, Esporte e Lazer. O prazo de vigência do presente Contrato é de 180 (cento e oitenta) dias, a contar da assinatura do contrato. 19/08/2022 á 19/02/2023.
Edição Nº 159 de 22/08/2022 - Pág. 284;Prefeitura Municipal de Parauapebas;Estado do Pará;22/08/2022;ORIGEM INEXIGIBILIDADE Nº 6/2022-16SECULTCONTRATANTE PREFEITURA MUNICIPAL DE PARAUAPEBASCONTRATADA(O) JADSON DE AGUIAR TEXEIRA 76307905204OBJETO Contratação da empresa AGUIAR EVENTOS, para a realização de show musical da artista gospel Valesca Mayssa para as festividades em comemoração ao 28° aniversário da Vila Palmares Sul no Município de Parauapebas, estado do Pará, que acontecerá no dia 29 de julho de 2022.VALOR TOTAL R$ 60.000,00 (sessenta mil reais)VIGÊNCIA 30 (trinta) dias, contados a partir da assinatura pelas partes.DATA DA EMISSÃO 27 de julho de 2022.
Edição Nº 159 de 22/08/2022 - Pág. 230;Prefeitura Municipal de Vitória do Jari;Estado do Amapá;22/08/2022;"Processo Administrativo nº. 2901/2022-PMVJ, e anexos da INEXIGIBILIDADE DE LICITAÇÃO Nº. 022/2022-CPLCSO/PMVJ. Objeto: CONTRATAÇÃO DA EMPRESA AUOLLY PRODUÇÕES L. DAS G. DE O. ALMEIDA, PARA APRESENTAÇÃO DE SHOW ARTÍSTICO ""LETÍCIA AUOLY E BANDA"" PARA APRESENTAÇÃO NO DIA 10 DE SETEMBRO DE 2022, EM COMEMORAÇÃO ALUSIVA AO 28º ANIVERSÁRIO DE VITÓRIA DO JARI-AP. Contratante: Prefeitura Municipal de Vitória do Jari, CNPJ:00.720.553/0001-19. Contratada: a empresa AUOLLY PRODUÇÕES L. DAS G. DE O. ALMEIDA, CNPJ 43.092.883/0001-10, residente e domiciliado a Rua Stephan Houat, nº 487, Bairro Jardim Marco Zero, cidade de Macapá, Amapá, CEP: 68.903-193. Valor do Contrato: R$ 22.000,00 (vinte e dois mil reais). Amparo Legal: Lei 8.666 de 21/06/1993, alterada pela Lei nº 8.883/1994 e Lei nº 9.648 de 27/05/1998.Processo Administrativo nº. 2900/2022-PMVJ, e anexos da INEXIGIBILIDADE DE LICITAÇÃO Nº. 023/2022-CPLCSO/PMVJ. Objeto: CONTRATAÇÃO DA EMPRESA RC PRODUÇÕES ARTÍSTICAS LTDA - BANDA RAMON CARDOSO, PARA APRESENTAÇÃO NO DIA 07, EM COMEMORAÇÃO AO ANIVERSÁRIO DA CIDADE, NO MUNICÍPIO DE VITÓRIA DO JARI-AP. Contratante: Prefeitura Municipal de Vitória do Jari, CNPJ:00.720.553/0001-19. Contratada: RC PRODUÇÕES ARTÍSTICAS LTDA, CNPJ nº 32.486.340/0001-60, residente e domiciliado na Rua 6 Chácara, nº 276 18, Setor Habitacional VI, cidade Brasília, estado Distrito Federal, CEP 72.006-610. Valor do Contrato: R R$ 30.000,00 (trinta mil reais). Amparo Legal: Lei 8.666 de 21/06/1993, alterada pela Lei nº 8.883/1994 e Lei nº 9.648 de 27/05/1998."
Edição Nº 158 de 19/08/2022 - Pág. 214;Prefeitura Municipal de Porto Alegre do Norte;Estado de Mato Grosso;19/08/2022;ADMINISTRATIVO Nº 41/2022. FUNDAMENTO: Pregão Presencial nº 24/2022 Processo Administrativo nº 105/2022, Adesão a Ata de Registro de Preço nº 138/2022, Pregão Presencial nº 45/2022 da Prefeitura Municipal Canabrava do Norte/MT. EMPRESA: NT PROMOTORA DE EVENTOS LTDA - EPP CNPJ nº 42.180.015/0001-29 Valor total R$ 122.000,00 (cento e vinte e dois mil reais). OBJETO: Contratação de empresa para prestação de serviços de locação de estrutura complementares para a realização de Rodeio Show no Município de Porto Alegre do Norte/MT, nos dias 24 a 27 de Agosto de 2022. TERMO DE CONVENIO 1340/2022 PROCESSO Nº SECEL - PRO - 2022/02941, para atender as necessidades da Secretaria de Educação, Cultura, Esporte e Lazer. O prazo de vigência do presente Contrato é de 180 (cento e oitenta) dias, a contar da assinatura do contrato. 17/08/2022 á 17/02/2023.
Edição Nº 157 de 18/08/2022 - Pág. 289;PREFEITURA MUNICIPAL DE BREJO DO CRUZ;Estado da Paraíba;18/08/2022;OBJETO: Contratação do cantor Rodolfo Lopes da Silva, a ser realizado um show artístico na festa de emancipação política da cidade no dia 24 de setembro de 2022 em praça pública em Brejo do Cruz - PB. FUNDAMENTO LEGAL: Inexigibilidade de Licitação nº IN00013/2022. DOTAÇÃO: Recursos Próprios do Município de Brejo do Cruz: Unidade: 03 Secretaria de Administração Funcional: 04.122.1003.2.004 Manutenção das Atividades da Secretaria da Administração 3.3.90.39.00.00.00.00 0500 Outros Serviços de Terceiros - Pessoa Jurídica - Recursos não vinculados de impostos Unidade: 10 Secretaria de Cultura Desportos e Turismo Funcional: 13.392.2013.2.043 Incentivo a Promoção de Eventos e Atividades Artísticas e Culturais 3.3.90.39.00.00.00.00 0500 Outros Serviços de Terceiros - Pessoa Jurídica - Recursos não vinculados de impostos Funcional: 13.392.2013.2.044 Realização de Eventos e Festividades Populares no Município 3.3.90.39.00.00.00.00 0500 Outros Serviços de Terceiros - Pessoa Jurídica - Recursos não vinculados de impostos Funcional: 27.122.1003.2.010 Manutenção das Atividades da Secretaria de Cultura , Desporto e Turismo 3.3.90.39.00.00.00.00 0500 Outros Serviços de Terceiros - Pessoa Jurídica - Recursos não vinculados de impostos. VIGÊNCIA: até 16/11/2022. PARTES CONTRATANTES: Prefeitura Municipal de Brejo do Cruz e: CT Nº 00168/2022 - 16.08.22 - RODOLFO LOPES DA SILVA - PRODUCAO MUSICAL - R$ 20.000,00.
Edição Nº 157 de 18/08/2022 - Pág. 283;Prefeitura Municipal de Parauapebas;Estado do Pará;18/08/2022;Espécie: ORIGEM INEXIGIBILIDADE Nº 6/2022-12SECULTCONTRATANTE PREFEITURA MUNICIPAL DE PARAUAPEBASCONTRATADA(O) MARIANA FAGUNDES PRODUÇÕES EIRELIOBJETO Contratação da empresa MARIANA FAGUNDES PRODUÇÕES EIRELI - EPP, para a realização de show musical da artista Mariana Fagundes, para as festividades em comemoração ao 28° aniversário da Vila Palmares Sul, no Município de Parauapebas, Estado do Pará, que acontecerá no dia 30 de Julho de 2022. VALOR TOTAL R$ 80.000,00 (oitenta mil reais). VIGÊNCIA 30 (trinta) dias, contados a partir da assinatura pelas partes. DATA DA EMISSÃO 27 de julho de 2022.
Edição Nº 156 de 17/08/2022 - Pág. 323;Prefeitura Municipal de Formoso do Araguaia;Estado do Tocantins;17/08/2022;"Processo Administrativo n° 2022/775Vinculação a Inexigibilidade nº 006/2022Contratante: Munícipio de Formoso do Araguaia/TO-CNPJ:02.075.216/0001-41Contratada: AB Promoções e Produções Artísticas e Gravadora - Eireli - CNPJ: 36.377.860/0001-96Objeto: Contratação de show artístico com cantor AMADO BATISTA a ser realizado no Parque de Exposição Agropecuária, no município de Formoso do Araguaia-TO, no dia 14/09/2022.Data da Assinatura: 16 de agosto de 2022Preço: R$ 225.000,00 (duzentos e vinte e cinco mil reais)Dotação Orçamentária / Natureza/ Fonte/ Ficha.0003.0010.20.122.0026.2298/ 33.90.39 / 1.700; 1.500 / 192Signatários: Heno Rodrigues da Silva - Prefeito MunicipalAmado Rodrigues Batista - Representante da Contratada."
Edição Nº 156 de 17/08/2022 - Pág. 275;PREFEITURA MUNICIPAL DE BREJO DO CRUZ;Estado da Paraíba;17/08/2022;OBJETO: Contratação do cantor Bruno Martins para a realização de um show artístico na festa de Emancipação Política da cidade, no dia 24 de setembro de 2022 em praça pública, em Brejo do Cruz-PB. FUNDAMENTO LEGAL: Inexigibilidade de Licitação nº IN00015/2022. DOTAÇÃO: Recursos Próprios do Município de Brejo do Cruz: Unidade: 03 Secretaria Municipal de Administração Funcional: 04.122.1003.2.004 Manutenção das Atividades da Secretaria da Administração 3.3.90.39.00.00.00.00 0500 Outros Serviços de Terceiros - Pessoa Jurídica - Recursos não vinculados de impostos Unidade: 10: Secretaria de Cultura, Desportos e Turismo Funcional: 13.392.2013.2.043 Incentivo e Promoção de Eventos e Atividades Artísticas e Culturais 3.3.90.39.00.00.00.00 0500 Outros Serviços de Terceiros - Pessoa Jurídica - Recursos não vinculados de impostos Funcional: 13.392.2013.2.044 Realização de Eventos e Festividades Populares no Município 3.3.90.39.00.00.00.00 0500 Outros Serviços de Terceiros - Pessoa Jurídica - Recursos não vinculados de impostos Funcional: 27.122.1003.2.010 Manutenção das Atividades da Secretaria de Cultura, Desporto e Turismo 3.3.90.39.00.0.00.00 0500 Outros Serviços - Pessoa Jurídica - Recursos não vinculados de impostos. VIGÊNCIA: até 16/11/2022. PARTES CONTRATANTES: Prefeitura Municipal de Brejo do Cruz e: CT Nº 00170/2022 - 16.08.22 - ECR PROMOCOES E LOCACOES LTDA - R$ 6.000,00.
Edição Nº 155 de 16/08/2022 - Pág. 190;Prefeitura Municipal de Porto Grande;Estado do Amapá;16/08/2022;"Contrato nº 152/2022-PMPG, Inexigibilidade de Licitação nº 007/2022-CPL/PMPG, Processo: 2012.04384.2022; Objeto: Contratação de Show Artístico para a Realização do XXVIII Festival do Abacaxi no Município de Porto Grande/AP. Local: Balneário Municipal de Porto Grande/AP, Contratado: MCM CONSULTORIA E PRODUÇÕES EIRELI - CNPJ Nº 14.291.065/0001-48 (BANDA VIVIANE BATIDÃO), SERVIÇO: SHOW ARTÍSTICO - Valor R$ 65.000,00 (Sessenta e cinco mil);Contrato nº 153/2022-PMPG, Inexigibilidade de Licitação nº 008/2022-CPL/PMPG, Processo: 2012.04385.2022; Objeto: Contratação de Show Artístico para a Realização do XXVIII Festival do Abacaxi no Município de Porto Grande/AP. Local: Balneário Municipal de Porto Grande/AP, Contratado: JACKSON M A POMPILIO UNIPESSOAL LTDA - CNPJ Nº 37.614.326/0001-19 (DJ LORRAN), SERVIÇO: SHOW ARTÍSTICO - Valor R$ 65.000,00 (Sessenta e cinco mil) - Dotação Orçamentária: Programa: 13.392.0473.2089.0000-Manunteção das Atividades c/ Evento Festival do Abacaxi; Elemento de Despesa: 3.3.90.39.00-Outros Serviços de Terceiros Pessoa Jurídica; Fonte de Recurso: R.P.M.; Fundamento legal: Art. 25, Inciso III, da Lei 8.666/93; O prazo de vigência do contrato é de 30 (trinta) dias, contado da data da sua assinatura."
Edição Nº 154 de 15/08/2022 - Pág. 281;Prefeitura Municipal de Vitória do Jari;Estado do Amapá;15/08/2022;Processo Administrativo nº. 2305/2022-PMVJ, e anexos da INEXIGIBILIDADE DE LICITAÇÃO Nº. 021/2022-CPLCSO/PMVJ. Objeto: CONTRATAÇÃO DE SHOW ARTÍSTICO DE ATRAÇÃO NACIONAL BANDA FORROZÃO TROPIKÁLIA PARA APRESENTAÇÃO NO DIA 07 DE SETEMBRO DE 2022, EM COMEMORAÇÃO ALUSIVA AO 28º ANIVERSÁRIO DE VITÓRIA DO JARI-AP. Contratante: Prefeitura Municipal de Vitória do Jari, CNPJ:00.720.553/0001-19. Contratada: a empresa RONALD ANDRÉ MATOS DE OLIVEIRA 99020750291, CNPJ 41.106.548/0001-06, residente e domiciliado a Rua Osvaldo Cruz - nº 657, Paraíso, cidade de Santana, Amapá, CEP: 68.928-003. Valor do Contrato: R$ 100.000,00 (cem mil reais). Amparo Legal: Lei 8.666 de 21/06/1993, alterada pela Lei nº 8.883/1994 e Lei nº 9.648 de 27/05/1998.Processo Administrativo nº. 2306/2022-PMVJ, e anexos da INEXIGIBILIDADE DE LICITAÇÃO Nº. 020/2022-CPLCSO/PMVJ. Objeto: CONTRATAÇÃO DE SHOW ARTÍSTICO DE ATRAÇÃO NACIONAL BANDA MAGNÍFICOS PARA APRESENTAÇÃO NO DIA 10 DE SETEMBRO DE 2022, EM COMEMORAÇÃO ALUSIVA AO 28º ANIVERSÁRIO DE VITÓRIA DO JARI-AP. Contratante: Prefeitura Municipal de Vitória do Jari, CNPJ:00.720.553/0001-19. Contratada: BANDA MAGNÍFICOS PRODUÇÕES E EVENTOS ARTISTICOS LTDA, CNPJ nº 01.509.178/0001-25, residente e domiciliado a Avenida Olímpio Gomes, nº 73, Centro, cidade Monteiro, estado Paraíba, CEP 58.500-000. Valor do Contrato: R$ 175.000,00 (cento e setenta e cinco mil reais). Amparo Legal: Lei 8.666 de 21/06/1993, alterada pela Lei nº 8.883/1994 e Lei nº 9.648 de 27/05/1998.
Edição Nº 153 de 12/08/2022 - Pág. 378;Prefeitura Municipal de Pacajá;Estado do Pará;12/08/2022;ORIGEM: INEXIGIBILIDADE Nº 6/2022-013-PMP. CONTRATANTE: PREFEITURA MUNICIPAL DE PACAJÁ. CONTRATADO: SANTA GERAÇAO LTDA, CNPJ: 47.377.194/0001-02. VALOR: R$ 40.000,00 (quarenta mil reais). OBJETO: contratação de pessoa jurídica para prestação de serviço para apresentação de show artístico de música gospel, na marcha pra Jesus no município de Pacajá para atender a demanda da prefeitura municipal de Pacajá/PA. Exercício 2022 Atividade 0207.133920307.2.109 Manutenção das Atividades Culturais Existentes, Classificação econômica 3.3.90.39.00 Outros serv. de terc. pessoa jurídica, Subelemento 3.3.90.39.22. VIGÊNCIA: 11 de agosto de 2022 a 30 de dezembro de 2022 DATA DA ASSINATURA: 11 de agosto de 2022
Edição Nº 150 de 09/08/2022 - Pág. 161;Prefeitura Municipal de Vitória do Jari;Estado do Amapá;09/08/2022;EXTRATO DE CONTRATO nº 070/2022-PMVJProcesso Administrativo nº. 2104/2022-PMVJ, e anexos da INEXIGIBILIDADE DE LICITAÇÃO Nº. 017/2022-CPLCSO/PMVJ. Objeto: CONTRATAÇÃO DE SHOW ARTÍSTICO APARELHAGEM TREPIDANTE PARA APRESENTAÇÃO NO DIA 09 DE SETEMBRO DE 2022, EM COMEMORAÇÃO AO 28º ANIVERSÁRIO DE VITÓRIA DO JARI/AP - VITÓRIA FEST. Contratante: Prefeitura Municipal de Vitória do Jari, CNPJ:00.720.553/0001-19. Contratada: a empresa WALDENY PICANÇO DE SOUZA 77530411268, inscrita no CNPJ Nº: 40.898.557/0001-06, com sede na Avenida Henrique Galúcio, nº 216, Bairro Central, cidade de Macapá, Amapá, CEP: 68.900-115. Valor do Contrato: R$ 72.680,00 (setenta e dois mil seiscentos e oitenta reais). Amparo Legal: Lei 8.666 de 21/06/1993, alterada pela Lei nº 8.883/1994 e Lei nº 9.648 de 27/05/1998.EXTRATO DE CONTRATO nº 071/2022-PMVJProcesso Administrativo nº. 2105/2022-PMVJ, e anexos da INEXIGIBILIDADE DE LICITAÇÃO Nº. 018/2022-CPLCSO/PMVJ. Objeto: CONTRATAÇÃO DE SHOW ARTÍSTICO DJ LORRAN PARA APRESENTAÇÃO NO DIA 11 DE SETEMBRO DE 2022, EM COMEMORAÇÃO AO 28º ANIVERSÁRIO DE VITÓRIA DO JARI/AP - VITÓRIA FEST. Contratante: Prefeitura Municipal de Vitória do Jari, CNPJ:00.720.553/0001-19. Contratada: a empresa JACKSON M A POMPILIO UNIPESSOAL, CNPJ Nº: 37.614.326/0001-19, com sede na Travessa Padre Eutíquio, nº 3954, Bairro Condor, Belém - PA, CEP: 66.065-165. Valor do Contrato: R$ 60.000,00 (sessenta mil reais). Amparo Legal: Lei 8.666 de 21/06/1993, alterada pela Lei nº 8.883/1994 e Lei nº 9.648 de 27/05/1998.EXTRATO DE CONTRATO nº 072/2022-PMVJProcesso Administrativo nº. 2103/2022-PMVJ, e anexos da INEXIGIBILIDADE DE LICITAÇÃO Nº. 016/2022-CPLCSO/PMVJ. Objeto: CONTRATAÇÃO DE SHOW ARTÍSTICO DE ATRAÇÃO NACIONAL BANDA ANJOS DE RESGATE PARA APRESENTAÇÃO NO DIA 08 DE SETEMBRO DE 2022, EM COMEMORAÇÃO ALUSIVA AO 28º ANIVERSÁRIO DE VITÓRIA DO JARI-AP. Contratante: Prefeitura Municipal de Vitória do Jari, CNPJ:00.720.553/0001-19. Contratada: a empresa ERALDO SILVA MATTOS - EPP, CNPJ 58.311.572/0001-71, residente e domiciliado a Avenida Olivio Nicoli, nº 39, Vila Canevari, cidade de Cruzeiro, São Paulo, CEP: 12.710-060. Valor do Contrato: R$ 72.000,00 (setenta e dois mil reais). Amparo Legal: Lei 8.666 de 21/06/1993, alterada pela Lei nº 8.883/1994 e Lei nº 9.648 de 27/05/1998.
Edição Nº 148 de 05/08/2022 - Pág. 258;Prefeitura Municipal de Canabrava do Norte;Estado de Mato Grosso;05/08/2022;"ORIGEM: INEXIGIBILIDADE DE LICITAÇÃO Nº 005/2022 - PROCESSO ADMINISTRATIVO Nº 00004606/2022; CONTRATANTE: PREFEITURA MUNICIPAL DE CANABRAVA DO NORTE/MT; CONTRATADO: C &amp; C PRODUÇÕES E SHOWS LTDA - ME; OBJETO: Contratação de empresa especializada na promoção de eventos para a realização de Show com a Dupla Sertaneja Cléber e Cauan no dia 01/09/2022, durante o evento denominado ""7ª Expobrava"". VALOR TOTAL: R$ 160.000,00 (cento e sessenta mil reais). VIGÊNCIA: 30 (trinta) dias após a assinatura do contrato. DATA DA ASSINATURA: 04 de Agosto de 2022;"
Edição Nº 148 de 05/08/2022 - Pág. 258;Prefeitura Municipal de Canabrava do Norte;Estado de Mato Grosso;05/08/2022;"ORIGEM: INEXIGIBILIDADE DE LICITAÇÃO Nº 007/2022 - PROCESSO ADMINISTRATIVO Nº 00004607/2022; CONTRATANTE: PREFEITURA MUNICIPAL DE CANABRAVA DO NORTE/MT; CONTRATADO: CULTURA SERTANEJA PRODUÇÕES ARTISTICAS LTDA - ME; OBJETO: Contratação de empresa especializada na promoção de eventos para a realização de Show com a Dupla Sertaneja João de Souza e Bonifácio no dia 02/09/2022, durante o evento denominado ""7ª Expobrava"". VALOR TOTAL: R$ 80.000,00 (oitenta mil reais). VIGÊNCIA: 30 (trinta) dias após a assinatura do contrato. DATA DA ASSINATURA: 04 de Agosto de 2022;"
Edição Nº 148 de 05/08/2022 - Pág. 268;Prefeitura Municipal de Conselheiro Pena;Estado de Minas Gerais;05/08/2022;"Contrato nº 067/2022, Processo Licitatório nº 085/2022, Inexigibilidade 020/2022. Objeto: Contratação direta com vistas à contratação de show musical da dupla sertaneja João Neto &amp; Frederico para apresentação artística da 40ª (quadragésima) exposição agropecuária de Conselheiro Pena/MG, a realizar-se no dia 24 setembro de 2022. Empresa Contratada: Contract Show Produções Artísticas Ltda, CNPJ: 14.738.613/0001-35. Valor do Contrato: R$ 125.000,00 (cento e vinte e cinco mil reais). Nádia Filomena Dutra França - Prefeita.Contrato nº 072/2022, Processo Licitatório nº 086/2022, Inexigibilidade n° 021/2022. Empresa Contratada: DVH Produções Artística Ltda, CNPJ: 28.492.798/0001-55. Valor do Contrato: R$ 190.000,00 (cento e noventa mil reais). Nádia Filomena Dutra França - Prefeita."
